{"contractVersion":"nest.worker.v1","taskRef":"task:index-create","worldRef":"world:alpha","taskKind":"INDEX_PROJECTION","generation":7,"eventRef":"event:10101010-1010-4010-8010-101010101010","projectionGeneration":42,"materialDigest":"sha256:d1bdd23f8d443df981cb9f1dbea688a47e995fbf98d25bbd2ec5ac9ec6b537b5","embeddingManifest":{"modelRef":"embedding:fixture-model","dimensions":384,"version":"fixture-v1"},"schemaManifest":{"schemaRef":"index-schema:fixture-v1","version":"fixture-v1"},"outcome":"APPLIED","appliedRevisionRef":"revision:aaaaaaaa-aaaa-4aaa-8aaa-aaaaaaaaaaaa"}
