{"contractVersion":"nest.worker.v1","taskRef":"task:index-supersede","worldRef":"world:alpha","taskKind":"INDEX_PROJECTION","generation":9,"eventRef":"event:30303030-3030-4030-8030-303030303030","projectionGeneration":42,"materialDigest":"sha256:ec9b549cbfdb248f52f59196998591c9a84510149aba0244a7f513f14481ef5f","embeddingManifest":{"modelRef":"embedding:fixture-model","dimensions":384,"version":"fixture-v1"},"schemaManifest":{"schemaRef":"index-schema:fixture-v1","version":"fixture-v1"},"outcome":"APPLIED","appliedRevisionRef":"revision:cccccccc-cccc-4ccc-8ccc-cccccccccccc"}
