{"contractVersion":"nest.worker.v1","taskRef":"task:index-revise","worldRef":"world:alpha","taskKind":"INDEX_PROJECTION","generation":8,"eventRef":"event:20202020-2020-4020-8020-202020202020","projectionGeneration":42,"materialDigest":"sha256:da0d8e617206d1e8d10d2414f1d283fea111ce433bd6221a9c125b662be5866a","embeddingManifest":{"modelRef":"embedding:fixture-model","dimensions":384,"version":"fixture-v1"},"schemaManifest":{"schemaRef":"index-schema:fixture-v1","version":"fixture-v1"},"outcome":"APPLIED","appliedRevisionRef":"revision:bbbbbbbb-bbbb-4bbb-8bbb-bbbbbbbbbbbb"}
